{
  "meta": {
    "version": "3.1",
    "generated": "2025-11-22T15:02:48.088974Z",
    "project": "src"
  },
  "names": [
    "config_loader",
    "Config",
    "__init__",
    "config_path",
    "Optional[str | Path]",
    "_load_config",
    "None",
    "_validate_config",
    "raw_config",
    "dict",
    "_find_config_file",
    "Optional[Path]",
    "get",
    "key",
    "str",
    "default",
    "Any",
    "__getattr__",
    "name",
    "get_config",
    "reload_config",
    "pathlib",
    "typing",
    "utils.utils_logger",
    "tomllib",
    "tomli",
    "indexer",
    "MutableDefault",
    "dataclass",
    "SQLInjection",
    "HardcodedSecret",
    "GlobalVariable",
    "LoggingUsage",
    "MissingTypeHint",
    "MissingDocstring",
    "ClassDependency",
    "CodeIndexer",
    "hash_length",
    "int",
    "index_parsed_files",
    "parsed_files",
    "list[ParsedFile]",
    "_add_name",
    "_add_file",
    "file_path",
    "_add_default_value",
    "_index_class",
    "cls",
    "ClassDef",
    "file_idx",
    "_index_function",
    "func",
    "FunctionDef",
    "_analyze_file",
    "parsed_file",
    "ParsedFile",
    "_is_mutable_default",
    "bool",
    "_get_mutable_type",
    "_has_complete_type_hints",
    "_detect_secret_type",
    "var_name",
    "_analyze_logging_usage",
    "content",
    "_has_logging_in_function",
    "_analyze_class_dependencies",
    "get_name_index",
    "Optional[int]",
    "get_file_index",
    "get_default_index",
    "get_statistics",
    "dataclasses",
    "parser",
    "utils.utils_hash",
    "ast",
    "utils.utils_file",
    "main",
    "PyIndexer",
    "project_path",
    "output_path",
    "minified",
    "index_project",
    "_build_indexes",
    "list",
    "_serialize_indexes",
    "_write_json_file",
    "filename",
    "data",
    "minify",
    "_print_statistics",
    "view_index",
    "index_path",
    "print_help",
    "argparse",
    "json",
    "sys",
    "datetime",
    "builders.builder_tech_index",
    "builders.builder_location",
    "builders.builder_docstrings",
    "builders.builder_comments",
    "ParameterInfo",
    "FunctionInfo",
    "ClassInfo",
    "ImportInfo",
    "CommentInfo",
    "ASTParser",
    "parse_file",
    "Path | str",
    "Optional[ParsedFile]",
    "_is_top_level",
    "node",
    "ast.AST",
    "tree",
    "ast.Module",
    "_extract_class",
    "ast.ClassDef",
    "Optional[ClassInfo]",
    "_extract_function",
    "ast.FunctionDef | ast.AsyncFunctionDef",
    "Optional[FunctionInfo]",
    "_extract_imports",
    "list[ImportInfo]",
    "_extract_comments",
    "source",
    "list[CommentInfo]",
    "_get_annotation",
    "ast.arg | ast.FunctionDef | ast.AsyncFunctionDef",
    "_get_decorator_name",
    "ast.expr",
    "_get_attribute_name",
    "ast.Attribute",
    "validator",
    "InputValidator",
    "validate_project_path",
    "path",
    "validate_output_path",
    "create_if_missing",
    "validate_format",
    "format_str",
    "validate_hash_length",
    "length",
    "validate_file_path",
    "must_exist",
    "validate_tech_index_path",
    "_is_readable",
    "Path",
    "_is_writable",
    "msgpack",
    "builder_comments",
    "CommentsBuilder",
    "project_name",
    "add_text",
    "text",
    "add_file",
    "add_module_comment",
    "location_id",
    "line_number",
    "add_class_comment",
    "add_function_comment",
    "build",
    "dict[str, Any]",
    "dict[str, int]",
    "get_todos",
    "list[tuple[str, int]]",
    "get_fixmes",
    "builder_docstrings",
    "DocstringsBuilder",
    "add_module_docstring",
    "line_start",
    "line_end",
    "add_class_docstring",
    "add_function_docstring",
    "builder_location",
    "LocationBuilder",
    "add_module_location",
    "add_class_location",
    "add_function_location",
    "add_import_location",
    "builder_tech_index",
    "TechIndexBuilder",
    "add_name",
    "get_location_id",
    "add_module",
    "parent_idx",
    "add_class",
    "base_classes",
    "list[str]",
    "add_function",
    "parent_class_idx",
    "add_import",
    "module_name",
    "add_typehint",
    "params",
    "list[tuple[str, str]]",
    "return_type",
    "str | None",
    "add_decorators",
    "decorator_names",
    "add_attribute",
    "type_name",
    "cli_index",
    "IndexCLI",
    "run",
    "args",
    "parse_arguments",
    "argparse.Namespace",
    "_get_output_filename",
    "base_name",
    "_get_serializer",
    "serializers.serializer_json",
    "serializers.serializer_msgpack",
    "cli_location",
    "LocationCLI",
    "serializer_base",
    "BaseSerializer",
    "ABC",
    "serialize",
    "abstractmethod",
    "str | Path",
    "deserialize",
    "input_path",
    "get_file_extension",
    "abc",
    "serializer_json",
    "JSONSerializer",
    "compress",
    "_is_gzip_file",
    "get_format_name",
    "gzip",
    "serializers.serializer_base",
    "serializer_msgpack",
    "MessagePackSerializer",
    "utils_file",
    "_validate_file_exists",
    "read_python_file",
    "max_size",
    "ensure_directory",
    "get_file_hash",
    "algorithm",
    "get_file_modified",
    "iso_format",
    "get_file_size",
    "find_python_files",
    "directory",
    "recursive",
    "list[Path]",
    "validate_path_safety",
    "get_relative_path",
    "base_path",
    "hashlib",
    "utils_hash",
    "hash_object",
    "hash_file",
    "hash_string_list",
    "strings",
    "utils_logger",
    "setup_logger",
    "log_file",
    "level",
    "format_string",
    "Optional[str]",
    "logging.Logger",
    "get_logger",
    "configure_root_logger",
    "set_log_level",
    "logger",
    "level_name",
    "logging",
    "viewer_index",
    "IndexViewer",
    "view",
    "filter_type",
    "show_stats",
    "_display_metadata",
    "index",
    "_display_all_sections",
    "_display_modules",
    "_display_classes",
    "_display_functions",
    "_display_imports",
    "_display_statistics"
  ],
  "files": [
    "config_loader.py",
    "indexer.py",
    "main.py",
    "parser.py",
    "validator.py",
    "__init__.py",
    "builders/builder_comments.py",
    "builders/builder_docstrings.py",
    "builders/builder_location.py",
    "builders/builder_tech_index.py",
    "builders/__init__.py",
    "cli/cli_index.py",
    "cli/cli_location.py",
    "cli/__init__.py",
    "serializers/serializer_base.py",
    "serializers/serializer_json.py",
    "serializers/serializer_msgpack.py",
    "serializers/__init__.py",
    "tests/__init__.py",
    "utils/utils_file.py",
    "utils/utils_hash.py",
    "utils/utils_logger.py",
    "utils/__init__.py",
    "viewers/viewer_index.py",
    "viewers/__init__.py"
  ],
  "modules": [
    [
      0,
      0,
      -1,
      0
    ],
    [
      26,
      1,
      -1,
      15
    ],
    [
      76,
      2,
      -1,
      53
    ],
    [
      72,
      3,
      -1,
      77
    ],
    [
      132,
      4,
      -1,
      100
    ],
    [
      2,
      5,
      -1,
      115
    ],
    [
      149,
      6,
      -1,
      116
    ],
    [
      166,
      7,
      -1,
      131
    ],
    [
      173,
      8,
      -1,
      144
    ],
    [
      179,
      9,
      -1,
      157
    ],
    [
      2,
      10,
      -1,
      176
    ],
    [
      201,
      11,
      -1,
      177
    ],
    [
      212,
      12,
      -1,
      196
    ],
    [
      2,
      13,
      -1,
      210
    ],
    [
      214,
      14,
      -1,
      211
    ],
    [
      224,
      15,
      -1,
      220
    ],
    [
      231,
      16,
      -1,
      233
    ],
    [
      2,
      17,
      -1,
      244
    ],
    [
      2,
      18,
      -1,
      245
    ],
    [
      233,
      19,
      -1,
      246
    ],
    [
      251,
      20,
      -1,
      261
    ],
    [
      256,
      21,
      -1,
      269
    ],
    [
      2,
      22,
      -1,
      278
    ],
    [
      269,
      23,
      -1,
      279
    ],
    [
      2,
      24,
      -1,
      294
    ]
  ],
  "classes": [
    [
      1,
      [],
      0,
      1
    ],
    [
      27,
      [],
      1,
      16
    ],
    [
      29,
      [],
      1,
      17
    ],
    [
      30,
      [],
      1,
      18
    ],
    [
      31,
      [],
      1,
      19
    ],
    [
      32,
      [],
      1,
      20
    ],
    [
      33,
      [],
      1,
      21
    ],
    [
      34,
      [],
      1,
      22
    ],
    [
      35,
      [],
      1,
      23
    ],
    [
      36,
      [],
      1,
      24
    ],
    [
      77,
      [],
      2,
      54
    ],
    [
      101,
      [],
      3,
      78
    ],
    [
      102,
      [],
      3,
      79
    ],
    [
      103,
      [],
      3,
      80
    ],
    [
      104,
      [],
      3,
      81
    ],
    [
      105,
      [],
      3,
      82
    ],
    [
      55,
      [],
      3,
      83
    ],
    [
      106,
      [],
      3,
      84
    ],
    [
      133,
      [],
      4,
      101
    ],
    [
      150,
      [],
      6,
      117
    ],
    [
      167,
      [],
      7,
      132
    ],
    [
      174,
      [],
      8,
      145
    ],
    [
      180,
      [],
      9,
      158
    ],
    [
      202,
      [],
      11,
      178
    ],
    [
      213,
      [],
      12,
      197
    ],
    [
      215,
      [
        216
      ],
      14,
      212
    ],
    [
      225,
      [
        215
      ],
      15,
      221
    ],
    [
      232,
      [
        215
      ],
      16,
      234
    ],
    [
      270,
      [],
      23,
      280
    ]
  ],
  "functions": [
    [
      2,
      0,
      0,
      2
    ],
    [
      5,
      0,
      0,
      3
    ],
    [
      7,
      0,
      0,
      4
    ],
    [
      10,
      0,
      0,
      5
    ],
    [
      12,
      0,
      0,
      6
    ],
    [
      17,
      0,
      0,
      7
    ],
    [
      19,
      -1,
      0,
      8
    ],
    [
      20,
      -1,
      0,